{
  "schemaVersion": "1.0.0",
  "sessionId": "11111111-1111-4111-8111-111111111111",
  "deviceId": "22222222-2222-4222-8222-222222222222",
  "devicePlatform": "garmin",
  "startedAt": "2026-08-29T10:00:00Z",
  "endedAt": "2026-08-29T11:12:30Z",
  "durationMilliseconds": 4350000,
  "recordingState": "completed",
  "syncStatus": "pending",
  "sport": "kitesurf",
  "visibility": "private",
  "trackSummary": {
    "pointsCount": 4348,
    "distanceMeters": 24630.4,
    "startedAt": "2026-08-29T10:00:02Z",
    "endedAt": "2026-08-29T11:12:28Z"
  },
  "speedSummary": { "maximumSpeedMps": 15.2, "averageMovingSpeedMps": 8.1 },
  "heartRateSummary": {
    "samplesCount": 861,
    "averageBpm": 146,
    "maximumBpm": 181
  },
  "jumpSummary": {
    "jumpsCount": 17,
    "highestJumpMeters": 8.7,
    "longestJumpDistanceMeters": 21.4,
    "longestAirtimeMilliseconds": 4200
  },
  "sensorQualitySummary": {
    "qualityFlags": ["gps_degraded"],
    "degradedDurationMilliseconds": 14000
  },
  "algorithmMetadata": {
    "algorithmVersion": "jump-engine-height-v1",
    "confidence": 0.82,
    "qualityFlags": ["gps_degraded"]
  }
}
